id,type,category,title,body,active
BT309,ビジネス豆知識,業務・品質,改善の継続,改善は一度で終わらせず、試して見直すことで効果が高まります。,true
BT310,ビジネス豆知識,業務改善,属人化防止,特定の人しか分からない業務は、共有や手順化を進めることで継続性が高まります。,true
BT311,ビジネス豆知識,資料作成,表記統一,日付・単位・用語の表記をそろえると、資料の読みやすさと信頼性が高まります。,true
BT312,ビジネス豆知識,情報セキュリティ,添付ファイル,添付ファイルは送信先・内容・ファイル名を確認してから送信することが重要です。,true
BT313,ビジネス豆知識,ハラスメント防止,職場環境,安心して意見を言える職場環境は、問題の早期発見とチームの改善につながります。,true
BT314,ビジネス豆知識,コミュニケーション,確認の一言,認識違いを防ぐには、最後に『理解に相違がないか』を確認することが有効です。,true
BT315,ビジネス豆知識,マネジメント,会議設計,会議は情報共有・議論・意思決定のどれを目的にするかで設計が変わります。,true
BT316,ビジネス豆知識,コミュニケーション,報連相,報告は事実・影響・次の対応を分けると、受け手が判断しやすくなります。,true
BT317,ビジネス豆知識,思考法,目的思考,目的から考えると、手段にとらわれず選択肢を広げられます。,true
BT318,ビジネス豆知識,コンプライアンス,SNS発信,SNSでは、個人アカウントでも会社情報や関係者情報の扱いに注意が必要です。,true
BT319,ビジネス豆知識,コミュニケーション,端的な共有,短く整理された共有は、忙しい相手にも伝わりやすくなります。,true
BT320,ビジネス豆知識,IT・DX,自動化,自動化は、頻度が高くルール化しやすい作業から検討すると進めやすくなります。,true
BT321,ビジネス豆知識,会計,単位と期間,資料の数字は、単位と対象期間を明確にすると、誤解の少ない説明になります。,true
BT322,ビジネス豆知識,文書・メール,議事録,議事録は決定事項・未決事項・担当者・期限を残すことが重要です。,true
BT323,ビジネス豆知識,時間管理,準備2,準備に時間を使うことは、実行時の迷いを減らす投資になります。日々の業務でも意識したい視点です。,true
BT324,ビジネス豆知識,安全衛生,体調共有,体調不良を早めに共有すると、本人の安全と業務継続の両方を守りやすくなります。,true
BT325,ビジネス豆知識,文書・メール,全員返信,全員返信は、共有が必要な相手を見極めて使うと、情報過多や誤共有を防げます。,true
BT326,ビジネス豆知識,顧客・取引,競合理解,競合を知ることは、自社の強みと改善点を見つける手がかりになります。,true
BT327,ビジネス豆知識,法務・コンプライアンス,早期相談,法務やコンプライアンスの不安は、早めに相談するほど選択肢が広がります。,true
BT328,ビジネス豆知識,業務・品質,作業前確認,作業前の確認は、作業後の修正コストを減らす効果があります。,true
BT329,ビジネス豆知識,思考法,制約条件,制約を把握すると、現実的な打ち手を考えやすくなります。,true
BT330,ビジネス豆知識,IT・DX,個人情報の目的,個人情報は利用目的を意識して扱うことで、適正な管理につながります。,true
BT331,ビジネス豆知識,労務,残業申請,時間外労働は、事前申請と承認の流れを守ることで、適正な労務管理につながります。,true
BT332,ビジネス豆知識,法務,口頭合意,口頭で決まった内容も、後でメール等で確認しておくと認識違いを防げます。,true
BT333,ビジネス豆知識,コミュニケーション,沈黙の活用,すぐに答えを出さず考える時間を取ることも、質の高い対話につながります。,true
BT334,ビジネス豆知識,法務,権限確認,契約や発注に関わる判断は、社内の権限ルールに沿って進める必要があります。,true
BT335,ビジネス豆知識,ハラスメント防止,業務上の境界,業務上必要な範囲を意識することは、適切な距離感と信頼関係の維持につながります。,true
BT336,ビジネス豆知識,法務,契約確認,契約書では、金額・納期・責任範囲・解除条件を確認することが基本です。,true
BT337,ビジネス豆知識,IT・DX,バックアップ,バックアップは、障害や誤操作から業務を守るための備えです。,true
BT338,ビジネス豆知識,メンタルヘルス,ストレス要因,ストレスは仕事量だけでなく、人間関係や役割の曖昧さからも生じます。,true
BT339,ビジネス豆知識,リスク管理,持続可能性,持続可能な働き方は、短期成果だけでなく長期的な安定にもつながります。,true
BT340,ビジネス豆知識,法務,取引条件,取引条件は、例外対応ほど記録を残しておくと後日の確認が容易になります。,true
BT341,ビジネス豆知識,IT・DX,クラウド権限,クラウドの権限は便利さだけでなく、共有範囲の確認が重要です。,true
BT342,ビジネス豆知識,IT・DX,クラウド,クラウド利用では、利便性とアクセス管理の両方を考える必要があります。,true
BT343,ビジネス豆知識,営業,提案,提案は、相手の課題と自社の提供価値を結びつけることで伝わりやすくなります。,true
BT344,ビジネス豆知識,安全衛生,通路確保,通路や非常口をふさがない環境づくりは、日常的な安全確保の基本です。,true
BT345,ビジネス豆知識,顧客・取引,顧客の成功,顧客の成功を考えると、単なる対応ではなく価値提供の視点を持ちやすくなります。,true
BT346,ビジネス豆知識,労務,勤務予定共有,勤務予定やシフトの変更は、早めに共有すると業務調整がしやすくなります。,true
BT347,ビジネス豆知識,経営,KPI,KPIは、目標達成に向けた重要な指標です。数を増やしすぎないことも大切です。,true
BT348,ビジネス豆知識,マーケティング,ブランド,ブランドは、継続した体験と信頼の積み重ねで形成されます。,true
BT349,ビジネス豆知識,資料作成,対象者意識,資料は、誰が何を判断するためのものかを意識すると、内容を絞り込みやすくなります。,true
BT350,ビジネス豆知識,コミュニケーション,背景説明,依頼の背景を伝えると、相手が目的に合った判断をしやすくなります。,true
BT351,ビジネス豆知識,情報セキュリティ,情報共有,情報共有では、必要な相手に必要な範囲で伝えることが基本です。,true
BT352,ビジネス豆知識,ハラスメント防止,相談先,違和感を覚えたときに相談先を知っていると、問題の早期対応につながります。,true
BT353,ビジネス豆知識,コミュニケーション,確認,確認のタイミングを早めると、関係者の認識をそろえやすくなります。場面に応じて使い分けることが大切です。,true
BT354,ビジネス豆知識,文書・メール,読みやすさ,長い文章は見出しや箇条書きを使うと、読み手の負担を下げられます。,true
BT355,ビジネス豆知識,ハラスメント防止,配慮ある言動,相手の立場や受け取り方に配慮した言動は、安心して働ける職場づくりにつながります。,true
BT356,ビジネス豆知識,キャリア・健康,体調管理,体調管理は、安定して成果を出すための重要な仕事の一部です。,true
BT357,ビジネス豆知識,文書・メール,冒頭要約,冒頭に要約を置くと、読み手が重要点を早く理解できます。,true
BT358,ビジネス豆知識,リスク管理,未然防止,未然防止の視点を持つと、問題が起きる前に手を打ちやすくなります。,true
BT359,ビジネス豆知識,マネジメント,合意形成,合意形成では、反対意見の背景を理解することが大切です。,true
BT360,ビジネス豆知識,時間管理,作業ログ,作業ログを残すと、時間の使い方を振り返りやすくなります。,true
BT361,ビジネス豆知識,時間管理,先送り防止,短時間でできる作業は早めに処理すると、心理的な負担を減らせます。,true
BT362,ビジネス豆知識,経営,戦略,戦略は、何をするかだけでなく、何をしないかを決めることでもあります。,true
BT363,ビジネス豆知識,IT・DX,生成AI確認,生成AIの出力は、便利な下書きとして使い、最終判断は人が確認することが大切です。,true
BT364,ビジネス豆知識,思考法,因果関係,原因と結果を分けて考えると、対策を誤りにくくなります。,true
BT365,ビジネス豆知識,リスク管理,共有,不安材料を早めに共有すると、対応の選択肢を増やせます。場面に応じて使い分けることが大切です。,true