id,type,category,title,body,active
BT001,ビジネス豆知識,個人情報,印刷物管理,個人情報を含む印刷物は、出力後すぐに回収すると、置き忘れによる漏えいを防げます。,true
BT002,ビジネス豆知識,業務・品質,ムダの発見,待ち時間や探す時間に注目すると、業務改善のヒントが見つかります。,true
BT003,ビジネス豆知識,リスク管理,BCP,事業継続には、人・情報・設備・取引先の観点で備えを考えることが重要です。,true
BT004,ビジネス豆知識,メンタルヘルス,休息,休息は生産性を下げるものではなく、安定したパフォーマンスのために必要です。,true
BT005,ビジネス豆知識,会計・数字,予実管理,予算と実績の差を確認すると、改善の打ち手を考えやすくなります。,true
BT006,ビジネス豆知識,チームワーク,相互理解,互いの役割や制約を理解すると、協力しやすい関係を作れます。,true
BT007,ビジネス豆知識,顧客・取引,課題の深掘り,顧客の要望の背景を聞くと、本質的な課題に近づきやすくなります。,true
BT008,ビジネス豆知識,コンプライアンス,社会的信頼,コンプライアンスは法令だけでなく、社内規程や社会的な期待を守ることも含みます。,true
BT009,ビジネス豆知識,労務,有給休暇,有給休暇は計画的に取得すると、業務調整と健康管理の両立につながります。,true
BT010,ビジネス豆知識,マネジメント,意思決定,意思決定では、選んだ理由と選ばなかった理由を残すと後で振り返りやすくなります。,true
BT011,ビジネス豆知識,コミュニケーション,確認1,確認のタイミングを早めると、関係者の認識をそろえやすくなります。日々の業務でも意識したい視点です。,true
BT012,ビジネス豆知識,業務・品質,整理,情報を整理すると、次に取るべき行動が見えやすくなります。場面に応じて使い分けることが大切です。,true
BT013,ビジネス豆知識,業務・品質,途中確認,長い作業ほど途中確認を入れると、方向違いを早めに修正できます。,true
BT014,ビジネス豆知識,思考法,問いの設定,よい問いを立てると、集める情報と考える方向が明確になります。,true
BT015,ビジネス豆知識,顧客・取引,信頼の積み重ね,小さな約束を守ることが、長期的な顧客信頼につながります。,true
BT016,ビジネス豆知識,時間管理,準備,準備に時間をかけることは、実行時の判断をスムーズにするための重要な投資です。状況に応じて、どこまで準備するかを見極めることが大切です。,true
BT017,ビジネス豆知識,労務,打刻管理,出退勤や休憩の記録を正確に残すことは、労働時間管理の基本です。,true
BT018,ビジネス豆知識,資料作成,根拠提示,主張には根拠となるデータや事実を添えると、説得力が高まります。,true
BT019,ビジネス豆知識,顧客・取引,市場変化,市場の変化を観察すると、次の打ち手を早めに考えられます。,true
BT020,ビジネス豆知識,リスク管理,代替手段,重要業務には、担当者不在時の代替手段を用意しておくと安心です。,true
BT021,ビジネス豆知識,文書・メール,誤字確認,誤字脱字の確認は、資料の印象と信頼性を守る小さな品質管理です。,true
BT022,ビジネス豆知識,IT・DX,ログの価値,システムのログは、問題発生時の原因確認に役立つ重要な記録です。,true
BT023,ビジネス豆知識,コミュニケーション,確認,確認のタイミングを早めると、関係者の認識をそろえやすくなります。場面に応じて使い分けることが大切です。,true
BT024,ビジネス豆知識,顧客対応,約束管理,顧客との約束は、期限と内容を記録すると、信頼関係を維持しやすくなります。,true
BT025,ビジネス豆知識,コンプライアンス,内部通報,問題に気づいたときは、一人で抱え込まず、相談窓口や上位者に共有することが重要です。,true
BT026,ビジネス豆知識,情報セキュリティ,画面ロック,短時間の離席でも画面ロックを行うと、情報漏えいのリスクを下げられます。,true
BT027,ビジネス豆知識,コミュニケーション,期待値調整,相手の期待値を早めに確認すると、納品後のギャップを減らせます。,true
BT028,ビジネス豆知識,業務改善,見える化,業務の進捗や課題を見える化すると、早めの対応がしやすくなります。,true
BT029,ビジネス豆知識,会計・数字,単価意識,単価を意識すると、売上や利益の構造を理解しやすくなります。,true
BT030,ビジネス豆知識,安全衛生,転倒防止,床の濡れやケーブルの乱れを整えることは、身近な事故防止につながります。,true
BT031,ビジネス豆知識,会計・数字,数字の粒度,数字は目的に合った粒度で見ると、判断しやすくなります。,true
BT032,ビジネス豆知識,思考法,仮説思考,仮説を持って動くと、確認すべき情報が明確になります。,true
BT033,ビジネス豆知識,思考法,視点変更,視点を変えると、同じ問題でも別の解決策が見つかることがあります。場面に応じて使い分けることが大切です。,true
BT034,ビジネス豆知識,品質管理,品質,品質は製品やサービスだけでなく、手続きや情報の正確さにも関係します。,true
BT035,ビジネス豆知識,IT・DX,データの鮮度,データは出所と更新日を確認すると、判断材料として使いやすくなります。,true
BT036,ビジネス豆知識,文書・メール,表の使い方,比較や一覧は文章より表にすると、違いを把握しやすくなります。,true
BT037,ビジネス豆知識,コミュニケーション,感情と事実,感情と事実を分けると、冷静な対話につながりやすくなります。,true
BT038,ビジネス豆知識,コミュニケーション,依頼の基本,依頼は目的・期限・成果物を明確にすると、手戻りを減らせます。,true
BT039,ビジネス豆知識,メンタルヘルス,セルフケア,セルフケアでは、睡眠・休養・運動など基本的な生活習慣が大切です。,true
BT040,ビジネス豆知識,労務,労働条件,雇用形態にかかわらず、労働条件は明確に確認することが重要です。,true
BT041,ビジネス豆知識,文書・メール,文章の削減,情報を削ることも、伝わる資料を作るための重要な工夫です。,true
BT042,ビジネス豆知識,リスク管理,共有,不安材料を早めに共有すると、対応の選択肢を増やせます。場面に応じて使い分けることが大切です。,true
BT043,ビジネス豆知識,文書・メール,結論と補足,結論と補足を分けると、文章の読みやすさが高まります。,true
BT044,ビジネス豆知識,品質管理,ダブルチェック,重要な資料は、第三者確認やチェックリストを使うと見落としを減らせます。,true
BT045,ビジネス豆知識,リスク管理,再発防止の視点,再発防止では、人ではなく仕組みに目を向けると改善が進みやすくなります。,true
BT046,ビジネス豆知識,時間管理,集中環境,集中したいときは、通知や周囲の刺激を減らす工夫が有効です。,true
BT047,ビジネス豆知識,キャリア・健康,睡眠,十分な睡眠は、判断力や集中力を支える基本です。,true
BT048,ビジネス豆知識,労務,勤怠管理,勤怠は、労働時間を正確に把握するための重要な記録です。,true
BT049,ビジネス豆知識,品質管理,顧客満足,顧客満足は、期待値と実際の提供価値の差で左右されます。,true
BT050,ビジネス豆知識,マネジメント,任せ方,仕事を任せるときは、目的・範囲・相談基準をそろえることが重要です。,true
BT051,ビジネス豆知識,品質管理,原因分析,問題の原因を考えるときは、なぜ起きたかを段階的に確認すると整理しやすくなります。,true
BT052,ビジネス豆知識,経営,理念,経営理念は、日々の判断に方向性を与える基準として機能します。,true
BT053,ビジネス豆知識,コミュニケーション,確認質問,分からない点を早めに確認すると、後工程の手戻りを防ぎやすくなります。,true
BT054,ビジネス豆知識,情報セキュリティ,クラウド共有,クラウド共有では、閲覧権限と共有範囲を必要最小限にすることが大切です。,true
BT055,ビジネス豆知識,法務・コンプライアンス,規程確認,社内規程は、迷ったときの判断基準として活用できます。,true
BT056,ビジネス豆知識,時間管理,集中時間,集中が必要な仕事は、通知を減らしてまとまった時間を確保すると効率が上がります。,true
BT057,ビジネス豆知識,時間管理,完了定義,作業の完了条件を決めておくと、品質と進捗を判断しやすくなります。,true
BT058,ビジネス豆知識,コミュニケーション,相手視点,相手が何を知りたいかを先に考えると、説明の順番を組み立てやすくなります。,true
BT059,ビジネス豆知識,コミュニケーション,質問力,よい質問は、問題の所在を明確にし、次の行動を決めやすくします。,true
BT060,ビジネス豆知識,業務・品質,品質の入口,品質は最後の確認だけでなく、作業開始時の条件確認から始まります。,true
BT061,ビジネス豆知識,チームワーク,協力,協力しやすい状態を作ることも、成果を出すための大切な仕事です。場面に応じて使い分けることが大切です。,true
BT062,ビジネス豆知識,情報セキュリティ,端末管理,業務端末は紛失・盗難を想定して管理すると、情報資産を守りやすくなります。,true
BT063,ビジネス豆知識,法務,印紙確認,契約書は種類や金額によって印紙の要否が変わるため、事前確認が大切です。,true
BT064,ビジネス豆知識,リスク管理,影響範囲,リスクを考えるときは、誰にどのような影響があるかを見ることが重要です。,true
BT065,ビジネス豆知識,業務・品質,改善提案,改善提案は、問題点だけでなく期待効果を添えると伝わりやすくなります。,true
BT066,ビジネス豆知識,安全衛生,PC作業,長時間のPC作業では、姿勢と休憩を意識すると疲労や不調を防ぎやすくなります。,true
BT067,ビジネス豆知識,コミュニケーション,相手の時間,相手の時間を意識すると、要点を整理した伝え方につながります。,true
BT068,ビジネス豆知識,個人情報,保存場所,個人情報を含む資料は、定められた保存場所で管理することが大切です。,true
BT069,ビジネス豆知識,会計・数字,粗利,粗利を見ると、売上だけでは分からない収益性を把握しやすくなります。,true
BT070,ビジネス豆知識,チームワーク,相談の整理,相談するときは、状況・試したこと・相談したい点を整理すると、支援を受けやすくなります。,true
BT071,ビジネス豆知識,取引先対応,納期影響,納期に影響が出そうな場合は、早めの共有が調整余地を広げます。,true
BT072,ビジネス豆知識,取引先対応,不当要求,過度な要求を受けたときは、一人で判断せず相談することがリスク低減につながります。,true
BT073,ビジネス豆知識,思考法,意思決定の質,意思決定は、情報量だけでなく判断基準の明確さでも質が変わります。,true
BT074,ビジネス豆知識,コミュニケーション,言葉の選び方,同じ内容でも、相手に配慮した言葉を選ぶと受け止められ方が変わります。,true
BT075,ビジネス豆知識,マーケティング,顧客体験,顧客体験は、購入前・利用中・利用後のすべてで評価されます。,true
BT076,ビジネス豆知識,リスク管理,説明責任,説明責任を意識すると、日々の判断を丁寧に残す習慣が身につきます。,true
BT077,ビジネス豆知識,個人情報,必要最小限,個人情報は、利用目的に必要な範囲で取り扱うことが基本です。,true
BT078,ビジネス豆知識,IT・DX,保存場所,重要なファイルは定められた場所に保存すると、検索性と引き継ぎやすさが高まります。,true
BT079,ビジネス豆知識,文書・メール,レビュー依頼,資料レビューを依頼するときは、見てほしい観点を伝えると効果的です。,true
BT080,ビジネス豆知識,時間管理,朝の整理,始業時に今日の優先事項を確認すると、一日の迷いを減らせます。,true
BT081,ビジネス豆知識,コミュニケーション,相談の目的,相談では、判断してほしいのか助言がほしいのかを明確にすると話が進みやすくなります。,true
BT082,ビジネス豆知識,キャリア・健康,弱みの補完,弱みはなくすだけでなく、仕組みや周囲の協力で補うこともできます。,true
BT083,ビジネス豆知識,リスク管理,共有,不安材料を早めに共有すると、対応の選択肢を増やせます。場面に応じて使い分けることが大切です。,true
BT084,ビジネス豆知識,業務改善,完成イメージ,作業前に目的と完成イメージを確認すると、手戻りを減らしやすくなります。,true
BT085,ビジネス豆知識,チームワーク,感謝,感謝や承認の言葉は、チームの協力関係を強める小さな行動です。,true
BT086,ビジネス豆知識,時間管理,一日の締め,終業前に翌日の準備をしておくと、次の日をスムーズに始められます。,true
BT087,ビジネス豆知識,マネジメント,目標の分解,大きな目標は小さな行動に分解すると、実行しやすくなります。,true
BT088,ビジネス豆知識,IT・DX,システム化,システム化は、現状業務の目的と流れを整理してから進めると効果が出やすくなります。,true
BT089,ビジネス豆知識,文書・メール,件名,メールの件名は、用件と期限が分かるようにすると対応漏れを防げます。,true
BT090,ビジネス豆知識,業務・品質,整理,情報を整理すると、次に取るべき行動が見えやすくなります。場面に応じて使い分けることが大切です。,true
BT091,ビジネス豆知識,キャリア,強み,強みは得意なことだけでなく、周囲に価値を提供できる行動から見つかります。,true
BT092,ビジネス豆知識,キャリア・健康,感情の扱い,感情を自覚すると、冷静な判断を保ちやすくなります。,true
BT093,ビジネス豆知識,顧客対応,事実と推測,顧客対応では、事実と推測を分けて確認すると、回答の正確性が高まります。,true
BT094,ビジネス豆知識,文書・メール,メール冒頭,メール冒頭で用件を示すと、読み手が対応内容を把握しやすくなります。,true
BT095,ビジネス豆知識,法務・コンプライアンス,相談文化,疑問を相談できる文化は、コンプライアンスリスクの低減につながります。,true
BT096,ビジネス豆知識,顧客対応,要望共有,顧客からの重要な要望は、早めに関係者へ共有すると対応の質が上がります。,true
BT097,ビジネス豆知識,IT・DX,AI活用,生成AIを使うときは、入力情報の機密性と出力内容の確認が重要です。,true
BT098,ビジネス豆知識,時間管理,見積り,作業時間は少し余裕を持って見積もると、急な変更にも対応しやすくなります。,true
BT099,ビジネス豆知識,時間管理,準備,準備に時間を使うことは、実行時の迷いを減らす投資になります。場面に応じて使い分けることが大切です。,true
BT100,ビジネス豆知識,リスク管理,代替案,一つの方法に依存しすぎないことは、業務継続の安心につながります。,true
BT101,ビジネス豆知識,法務・コンプライアンス,承認の意味,承認は形式ではなく、責任と判断を明確にするための仕組みです。,true
BT102,ビジネス豆知識,文書・メール,図解,複雑な流れは図にすると、関係者間の理解がそろいやすくなります。,true
BT103,ビジネス豆知識,コミュニケーション,共通認識,打ち合わせの最後に認識を合わせると、次の行動が明確になります。,true
BT104,ビジネス豆知識,文書・メール,メール締め,メールの最後に依頼事項や期限を明記すると、対応漏れを防ぎやすくなります。,true
BT105,ビジネス豆知識,時間管理,締切逆算,締切から逆算して中間期限を置くと、余裕を持って進めやすくなります。,true
BT106,ビジネス豆知識,業務・品質,業務の目的,作業の目的を確認すると、本当に必要な手順を見直しやすくなります。,true
BT107,ビジネス豆知識,顧客・取引,顧客接点,顧客との接点は、商品やサービスの改善ヒントを得る機会になります。,true
BT108,ビジネス豆知識,品質管理,手戻り削減,手戻りを減らすには、最初の確認と途中共有が重要です。,true
BT109,ビジネス豆知識,顧客・取引,価格以外の価値,価格以外の価値を伝えると、顧客に選ばれる理由を作りやすくなります。,true
BT110,ビジネス豆知識,リスク管理,記録,トラブル対応では、日時・相手・内容・対応を記録することが重要です。,true
BT111,ビジネス豆知識,マネジメント,目的共有,マネジメントには、作業の指示だけでなく目的の共有が重要です。,true
BT112,ビジネス豆知識,コミュニケーション,結論先行,説明は結論から始めると、相手が全体像をつかみやすくなります。,true
BT113,ビジネス豆知識,業務改善,不要作業,慣例で続けている作業は、目的を確認すると改善のきっかけを見つけやすくなります。,true
BT114,ビジネス豆知識,キャリア・健康,変化への準備,変化に備えるには、今の仕事で得られる学びを意識することが大切です。,true
BT115,ビジネス豆知識,会計・数字,数字の意味,数字の背景を考えると、単なる集計から改善のヒントが見つかります。,true
BT116,ビジネス豆知識,時間管理,区切り,作業に区切りを作ると、進捗を実感しやすくなります。,true
BT117,ビジネス豆知識,自己管理,集中力管理,体調や集中力の変化に気づくことは、安定した成果を出すための自己管理につながります。,true
BT118,ビジネス豆知識,チームワーク,協力,協力しやすい状態を作ることも、成果を出すための大切な仕事です。場面に応じて使い分けることが大切です。,true
BT119,ビジネス豆知識,会計,請求書確認,請求書は宛名・金額・支払期日を確認すると、支払トラブルを防ぎやすくなります。,true
BT120,ビジネス豆知識,会計・数字,キャッシュ,利益が出ていても資金繰りが厳しくなることがあるため、現金の動きも重要です。,true
BT121,ビジネス豆知識,法務・コンプライアンス,記録文化,判断の記録は、後から説明責任を果たすための材料になります。,true
BT122,ビジネス豆知識,チームワーク,協力5,協力しやすい状態を作ることも、成果を出すための大切な仕事です。日々の業務でも意識したい視点です。,true
BT123,ビジネス豆知識,マネジメント,育成,育成には、経験の機会と振り返りの場をセットで用意することが効果的です。,true
BT124,ビジネス豆知識,安全衛生,避難経路,消火器や避難経路の場所を把握しておくと、緊急時に落ち着いて行動しやすくなります。,true
BT125,ビジネス豆知識,文書・メール,見出し設計,見出しを先に作ると、文章全体の構成を整理しやすくなります。,true
BT126,ビジネス豆知識,思考法,優先順位の基準,優先順位は、重要度・緊急度・影響度の観点で整理すると考えやすくなります。,true
BT127,ビジネス豆知識,ハラスメント防止,指導の焦点,指導では人格ではなく行動や事実に焦点を当てると、改善につながりやすくなります。,true
BT128,ビジネス豆知識,キャリア,振り返り,経験を成長につなげるには、何を学んだかを言語化することが有効です。,true
BT129,ビジネス豆知識,リスク管理,例外対応,例外対応は、理由と承認を明確にすると、後から説明しやすくなります。,true
BT130,ビジネス豆知識,コミュニケーション,言い換え確認,相手の話を自分の言葉で言い換えると、理解のズレに気づきやすくなります。,true
BT131,ビジネス豆知識,チームワーク,心理的安全性,心理的安全性は、遠慮なく意見や疑問を出せる環境づくりに関係します。,true
BT132,ビジネス豆知識,リスク管理,透明性,判断の透明性を高めると、関係者の納得を得やすくなります。,true
BT133,ビジネス豆知識,思考法,視点変更,視点を変えると、同じ問題でも別の解決策が見つかることがあります。場面に応じて使い分けることが大切です。,true
BT134,ビジネス豆知識,時間管理,準備,準備に時間を使うことは、実行時の迷いを減らす投資になります。場面に応じて使い分けることが大切です。,true
BT135,ビジネス豆知識,文書・メール,余白の効果,資料に余白を持たせると、重要な情報が目に入りやすくなります。,true
BT136,ビジネス豆知識,時間管理,優先順位の見直し,状況が変わったら優先順位を見直すことも、成果を出すために重要です。,true
BT137,ビジネス豆知識,IT・DX,デジタル習慣,日々の小さなデジタル活用が、業務効率化の土台になります。,true
BT138,ビジネス豆知識,コミュニケーション,期待の確認,期待されている成果を確認すると、仕事の方向性を合わせやすくなります。,true
BT139,ビジネス豆知識,IT・DX,アクセス最小化,必要な人だけが情報にアクセスできる状態は、セキュリティの基本です。,true
BT140,ビジネス豆知識,会計・数字,投資対効果,新しい施策は、費用だけでなく期待される効果と比較して考えることが大切です。,true
BT141,ビジネス豆知識,個人情報,アクセス権,個人情報へのアクセス権は、業務上必要な人に限定することが重要です。,true
BT142,ビジネス豆知識,IT・DX,データ品質,データの正確性は、判断の質に直結します。,true
BT143,ビジネス豆知識,IT・DX,入力確認,システム入力は確定前に内容を確認すると、後工程の修正を減らせます。,true
BT144,ビジネス豆知識,マネジメント,管理職の視点,管理職には、担当業務だけでなく組織全体への影響を見る視点が求められます。,true
BT145,ビジネス豆知識,法務・コンプライアンス,例外の管理,例外対応は、標準対応よりも理由と承認を丁寧に残すことが大切です。,true
BT146,ビジネス豆知識,IT・DX,情報の分類,情報は重要度に応じて扱い方を変えると、管理しやすくなります。,true
BT147,ビジネス豆知識,マネジメント,フィードバック,フィードバックは、事実に基づき具体的に伝えると、改善行動につながりやすくなります。,true
BT148,ビジネス豆知識,マネジメント,期待役割,役割への期待を言語化すると、メンバーが動きやすくなります。,true
BT149,ビジネス豆知識,キャリア・健康,フィードバック活用,フィードバックは、自分では気づきにくい改善点を知る機会になります。,true
BT150,ビジネス豆知識,マネジメント,評価の納得感,評価は基準と事実をそろえることで、納得感を高めやすくなります。,true
BT151,ビジネス豆知識,顧客・取引,クレームの価値,クレームには、期待とのズレや改善点が含まれていることがあります。,true
BT152,ビジネス豆知識,顧客・取引,フォロー,提案後のフォローは、相手の検討を進めるための大切な接点です。,true
BT153,ビジネス豆知識,キャリア・健康,学び直し,学び直しは、変化の大きい環境で価値を発揮し続ける支えになります。,true
