id,type,category,title,body,active
BT154,ビジネス豆知識,チームワーク,共有,チームでは、途中経過の共有が早いほど軌道修正しやすくなります。,true
BT155,ビジネス豆知識,文書・メール,ファイル名,ファイル名に日付や内容を入れると、検索と共有がしやすくなります。,true
BT156,ビジネス豆知識,マネジメント,1on1,定期的な対話は、業務課題だけでなく成長や不安の把握にも役立ちます。,true
BT157,ビジネス豆知識,チームワーク,未完了事項,引き継ぎでは、未完了事項と注意点を明確にすると、後任者が対応しやすくなります。,true
BT158,ビジネス豆知識,キャリア・健康,健康と成果,健康は個人の問題だけでなく、仕事の品質や継続性にも関係します。,true
BT159,ビジネス豆知識,マネジメント,育成の視点,育成では、答えを与えるだけでなく考える機会を作ることも大切です。,true
BT160,ビジネス豆知識,時間管理,準備,準備に時間を使うことは、実行時の迷いを減らす投資になります。場面に応じて使い分けることが大切です。,true
BT161,ビジネス豆知識,コミュニケーション,事実と意見,事実と意見を分けて伝えると、判断の精度が高まります。,true
BT162,ビジネス豆知識,業務・品質,小さな実験,小さく試してから広げると、改善の失敗リスクを抑えられます。,true
BT163,ビジネス豆知識,コミュニケーション,確認,確認のタイミングを早めると、関係者の認識をそろえやすくなります。場面に応じて使い分けることが大切です。,true
BT164,ビジネス豆知識,自己管理,予定確認,一日の始めに予定と期限を確認すると、優先順位をつけやすくなります。,true
BT165,ビジネス豆知識,業務・品質,標準と例外,標準作業と例外対応を分けると、改善すべき点を把握しやすくなります。,true
BT166,ビジネス豆知識,経営,収益モデル,収益モデルを理解すると、どの活動が利益につながるか見えやすくなります。,true
BT167,ビジネス豆知識,営業,見積,見積では、前提条件と範囲を明確にすると後の認識違いを防げます。,true
BT168,ビジネス豆知識,業務・品質,引き継ぎ品質,引き継ぎでは、作業内容だけでなく注意点と判断基準を残すと効果的です。,true
BT169,ビジネス豆知識,顧客対応,問い合わせ初動,問い合わせには早めに受領を伝えると、相手の不安を軽減しやすくなります。,true
BT170,ビジネス豆知識,会計,原価意識,原価を意識すると、価格設定や利益改善の視点が持ちやすくなります。,true
BT171,ビジネス豆知識,キャリア・健康,学びの記録,学んだことを記録すると、後から自分の成長を確認しやすくなります。,true
BT172,ビジネス豆知識,業務・品質,チェックリスト,チェックリストは、経験に頼りすぎない品質確保に役立ちます。,true
BT173,ビジネス豆知識,時間管理,完璧主義,最初から完璧を目指しすぎないことが、早い改善につながる場合があります。,true
BT174,ビジネス豆知識,顧客・取引,顧客分類,顧客を状況や目的で整理すると、適切な提案を考えやすくなります。,true
BT175,ビジネス豆知識,リスク管理,緊急時対応,緊急時は、完璧な情報を待つより初動の共有が重要な場合があります。,true
BT176,ビジネス豆知識,コミュニケーション,確認,確認のタイミングを早めると、関係者の認識をそろえやすくなります。場面に応じて使い分けることが大切です。,true
BT177,ビジネス豆知識,個人情報,持ち出し,個人情報を社外へ持ち出す場合は、必要性と管理方法を事前に確認しましょう。,true
BT178,ビジネス豆知識,文書・メール,宛先確認,メール送信前は、宛先・CC・添付ファイルを確認する習慣が重要です。,true
BT179,ビジネス豆知識,マネジメント,優先順位共有,チームの優先順位を共有すると、個々の判断がそろいやすくなります。,true
BT180,ビジネス豆知識,時間管理,準備,準備に時間を使うことは、実行時の迷いを減らす投資になります。場面に応じて使い分けることが大切です。,true
BT181,ビジネス豆知識,IT・DX,システム移行,システム変更では、現場の業務フローも一緒に見直すことが重要です。,true
BT182,ビジネス豆知識,リスク管理,共有,不安材料を早めに共有すると、対応の選択肢を増やせます。場面に応じて使い分けることが大切です。,true
BT183,ビジネス豆知識,情報セキュリティ,公共Wi-Fi,外出先の通信では、ネットワークの安全性を意識すると、情報漏えいリスクを下げられます。,true
BT184,ビジネス豆知識,情報セキュリティ,パスワード,パスワードは使い回さず、推測されにくいものを設定することが基本です。,true
BT185,ビジネス豆知識,リスク管理,リスクの兆候,小さな違和感に気づくことが、大きな問題の予防につながります。,true
BT186,ビジネス豆知識,時間管理,集中の波,自分が集中しやすい時間帯を知ると、重要な仕事を配置しやすくなります。,true
BT187,ビジネス豆知識,リスク管理,倫理観,倫理的な判断は、法令遵守だけでなく信頼を守るためにも重要です。,true
BT188,ビジネス豆知識,マーケティング,市場分析,市場を見るときは、顧客・競合・自社の3つの視点が役立ちます。,true
BT189,ビジネス豆知識,文書・メール,一文一義,一つの文に一つの意味を意識すると、文章が読みやすくなります。,true
BT190,ビジネス豆知識,資料作成,要点整理,長い資料は最初に要点を示すと、読み手が判断しやすくなります。,true
BT191,ビジネス豆知識,コミュニケーション,聞く姿勢,相手の話を最後まで聞く姿勢は、信頼関係を築く基本になります。,true
BT192,ビジネス豆知識,IT・DX,データ活用,データは集めるだけでなく、意思決定に使える形に整理することが大切です。,true
BT193,ビジネス豆知識,メンタルヘルス,相談,不調や不安を感じたときは、早めに相談することで深刻化を防ぎやすくなります。,true
BT194,ビジネス豆知識,顧客・取引,期待値管理,できることとできないことを明確にすると、信頼を損ないにくくなります。,true
BT195,ビジネス豆知識,時間管理,振り返り,一日の終わりに翌日の重要タスクを確認すると、始業時の迷いを減らせます。,true
BT196,ビジネス豆知識,品質管理,版管理,ファイルの版数や更新日を明確にすると、古い情報の利用を防ぎやすくなります。,true
BT197,ビジネス豆知識,マネジメント,影響範囲,判断に迷う案件は、基準と影響範囲を整理すると、意思決定しやすくなります。,true
BT198,ビジネス豆知識,時間管理,小分け作業,大きな仕事は小さな単位に分けると、着手しやすくなります。,true
BT199,ビジネス豆知識,マーケティング,顧客ニーズ,顧客ニーズは、表面的な要望だけでなく背景にある課題を見ることが大切です。,true
BT200,ビジネス豆知識,マネジメント,役割分担,役割分担を明確にすると、責任範囲と相談先が分かりやすくなります。,true
BT201,ビジネス豆知識,マネジメント,チームの学習,チームで振り返る時間を持つと、個人の経験を組織の知恵に変えられます。,true
BT202,ビジネス豆知識,キャリア,学習習慣,毎日少しずつ学ぶ習慣は、長期的な成長につながります。,true
BT203,ビジネス豆知識,法務・コンプライアンス,社外発信,社外に出す情報は、公開してよい内容かを確認する視点が必要です。,true
BT204,ビジネス豆知識,会計,経費精算,経費精算では、目的・日付・金額・証憑を正しく残すことが基本です。,true
BT205,ビジネス豆知識,法務,最新版管理,契約書や規程は、最新版かどうかを確認してから使用することが大切です。,true
BT206,ビジネス豆知識,顧客・取引,信頼維持,信頼は、日々の小さな対応の積み重ねで築かれます。,true
BT207,ビジネス豆知識,業務・品質,原因と対策,原因に合った対策を考えることで、再発防止の効果が高まります。,true
BT208,ビジネス豆知識,時間管理,中断対策,中断が多い仕事では、再開時のメモを残すと復帰しやすくなります。,true
BT209,ビジネス豆知識,キャリア,変化対応,環境変化に対応するには、新しい知識を取り入れる姿勢が重要です。,true
BT210,ビジネス豆知識,品質管理,固有名詞確認,資料提出前に数字・日付・固有名詞を確認すると、信頼性を高められます。,true
BT211,ビジネス豆知識,会議,時間管理,会議では終了時刻と議題の優先順位を意識すると、時間の質を高められます。,true
BT212,ビジネス豆知識,リスク管理,共有6,不安材料を早めに共有すると、対応の選択肢を増やせます。日々の業務でも意識したい視点です。,true
BT213,ビジネス豆知識,キャリア・健康,経験の棚卸し,経験を棚卸しすると、自分の強みや課題が見えやすくなります。,true
BT214,ビジネス豆知識,キャリア・健康,ストレスサイン,自分のストレスサインを知ると、早めに対処しやすくなります。,true
BT215,ビジネス豆知識,キャリア・健康,相談する力,早めに相談する力は、問題解決だけでなく周囲との協力にもつながります。,true
BT216,ビジネス豆知識,マネジメント,役割の重なり,役割が重なる部分を確認すると、抜け漏れと衝突を防ぎやすくなります。,true
BT217,ビジネス豆知識,法務・コンプライアンス,契約範囲,契約では、何を含み何を含まないかを明確にすることが重要です。,true
BT218,ビジネス豆知識,キャリア・健康,習慣化,小さな行動を続けることが、大きな成果につながることがあります。,true
BT219,ビジネス豆知識,業務・品質,属人化リスク,属人化を減らすには、判断基準や背景も共有することが役立ちます。,true
BT220,ビジネス豆知識,リスク管理,初動対応,トラブルの初動では、事実確認と関係者共有を早めることが大切です。,true
BT221,ビジネス豆知識,IT・DX,多要素認証,多要素認証は、パスワード漏えい時の被害を抑える有効な仕組みです。,true
BT222,ビジネス豆知識,思考法,比較思考,選択肢を比較すると、判断の理由を説明しやすくなります。,true
BT223,ビジネス豆知識,時間管理,段取り,着手前に必要情報・関係者・期限を確認すると、作業の停滞を防げます。,true
BT224,ビジネス豆知識,リスク管理,影響範囲確認,問題が起きたときは影響範囲を早めに確認すると、対応の優先順位を決めやすくなります。,true
BT225,ビジネス豆知識,営業,クレーム初動,クレーム対応では、まず事実確認と相手の不安の受け止めが重要です。,true
BT226,ビジネス豆知識,文書・メール,記録の価値,業務上の判断は、後から確認できる形で記録に残すと再現性が高まります。,true
BT227,ビジネス豆知識,情報セキュリティ,不審メール,不審なメールは、リンクや添付を開く前に送信元と文面を確認しましょう。,true
BT228,ビジネス豆知識,マネジメント,権限と責任,権限と責任をそろえると、判断のスピードと納得感が高まります。,true
BT229,ビジネス豆知識,キャリア・健康,強みの活用,強みを活かせる場面を増やすと、成果とやりがいにつながりやすくなります。,true
BT230,ビジネス豆知識,業務・品質,見える化の効果,進捗や課題を見える化すると、チーム全体で支援しやすくなります。,true
BT231,ビジネス豆知識,マネジメント,心理的安全性,意見を出しやすい環境は、問題の早期発見と改善につながります。,true
BT232,ビジネス豆知識,業務改善,5S,整理・整頓・清掃・清潔・しつけは、ミス防止や安全にもつながります。,true
BT233,ビジネス豆知識,労務,休憩時間,休憩時間は、実際に業務から離れていることが大切です。,true
BT234,ビジネス豆知識,業務・品質,ミスの共有,ミスを共有する文化は、同じ失敗を減らす組織学習につながります。,true
BT235,ビジネス豆知識,思考法,視点変更,視点を変えると、同じ問題でも別の解決策が見つかることがあります。場面に応じて使い分けることが大切です。,true
BT236,ビジネス豆知識,コンプライアンス,利益相反,個人の利害と会社の判断が重なる場面では、早めに相談することが大切です。,true
BT237,ビジネス豆知識,会議,事前共有,会議資料を事前に共有すると、当日の議論を深めやすくなります。,true
BT238,ビジネス豆知識,思考法,構造化,複雑な問題は、要素に分けると整理しやすくなります。,true
BT239,ビジネス豆知識,マネジメント,権限委譲,権限委譲では、任せる範囲と相談基準を明確にすることが大切です。,true
BT240,ビジネス豆知識,業務・品質,手順の更新,手順書は作って終わりではなく、実態に合わせて更新することが重要です。,true
BT241,ビジネス豆知識,会計・数字,変動費,変動費を理解すると、売上増減が利益に与える影響を見やすくなります。,true
BT242,ビジネス豆知識,時間管理,余裕時間,予定に余白を入れると、急な依頼にも対応しやすくなります。,true
BT243,ビジネス豆知識,会計・数字,数値比較,数字は単独ではなく、過去・計画・他部門と比較すると意味が見えやすくなります。,true
BT244,ビジネス豆知識,コミュニケーション,要約力,長い情報は一言で要約できると、相手の理解と判断を助けられます。,true
BT245,ビジネス豆知識,メンタルヘルス,境界線,仕事と休息の境界を意識すると、疲労の蓄積を防ぎやすくなります。,true
BT246,ビジネス豆知識,会計,予算管理,予算は使い切るためではなく、計画と実績の差を確認するためにも使います。,true
BT247,ビジネス豆知識,リスク管理,早期共有,リスクは小さいうちに共有すると、影響を抑えやすくなります。,true
BT248,ビジネス豆知識,キャリア,自己管理,体調・時間・感情の管理は、安定して成果を出すための土台です。,true
BT249,ビジネス豆知識,労務,安全衛生,安全衛生は、事故を防ぐだけでなく、働きやすい環境づくりにも関係します。,true
BT250,ビジネス豆知識,文書・メール,更新履歴,資料の更新履歴を残すと、変更内容を後から確認しやすくなります。,true
BT251,ビジネス豆知識,業務改善,再発防止,再発防止では、個人の注意だけでなく仕組みの改善を考えることが重要です。,true
BT252,ビジネス豆知識,顧客・取引,顧客体験,顧客体験は、商品そのものだけでなく対応の一つひとつで形成されます。,true
BT253,ビジネス豆知識,コンプライアンス,接待贈答,接待や贈答は、社内規程と社会通念の範囲内で行うことが基本です。,true
BT254,ビジネス豆知識,マーケティング,差別化,差別化は、価格だけでなく品質・体験・信頼でも実現できます。,true
BT255,ビジネス豆知識,時間管理,期限管理,期限が近いタスクは、進捗と残作業を分けて確認すると対応漏れを防げます。,true
BT256,ビジネス豆知識,マネジメント,評価,評価では、結果だけでなく行動やプロセスの確認も重要です。,true
BT257,ビジネス豆知識,思考法,全体最適,自分の担当だけでなく全体最適を考えると、組織への貢献が高まります。,true
BT258,ビジネス豆知識,会計・数字,損益分岐点,損益分岐点は、どの程度の売上で利益が出るかを考える目安になります。,true
BT259,ビジネス豆知識,時間管理,依頼のタイミング,相手に依頼する仕事は、早めに渡すほど調整の余地が広がります。,true
BT260,ビジネス豆知識,IT・DX,匿名化,分析では、個人が特定されない形に加工する視点が役立ちます。,true
BT261,ビジネス豆知識,個人情報,誤送信対策,個人情報を送る前には、宛先・添付・本文の三点確認が有効です。,true
BT262,ビジネス豆知識,業務改善,小さな改善,小さな改善を継続すると、業務全体の効率と品質が高まります。,true
BT263,ビジネス豆知識,チームワーク,協力,協力しやすい状態を作ることも、成果を出すための大切な仕事です。場面に応じて使い分けることが大切です。,true
BT264,ビジネス豆知識,思考法,視点変更4,視点を変えると、同じ問題でも別の解決策が見つかることがあります。日々の業務でも意識したい視点です。,true
BT265,ビジネス豆知識,会計,固定費,固定費は売上に関係なく発生するため、収益管理で重要な要素です。,true
BT266,ビジネス豆知識,IT・DX,端末更新,端末やソフトウェアを更新することは、脆弱性対策につながります。,true
BT267,ビジネス豆知識,顧客・取引,商談準備,商談前に相手の状況を調べると、会話の質を高めやすくなります。,true
BT268,ビジネス豆知識,IT・DX,入力ルール,入力ルールをそろえると、後から集計や検索がしやすくなります。,true
BT269,ビジネス豆知識,業務・品質,整理,情報を整理すると、次に取るべき行動が見えやすくなります。場面に応じて使い分けることが大切です。,true
BT270,ビジネス豆知識,品質管理,チェック,チェックは作業後だけでなく、作業前の条件確認にも効果があります。,true
BT271,ビジネス豆知識,コミュニケーション,確認,確認のタイミングを早めると、関係者の認識をそろえやすくなります。場面に応じて使い分けることが大切です。,true
BT272,ビジネス豆知識,思考法,視点変更,視点を変えると、同じ問題でも別の解決策が見つかることがあります。場面に応じて使い分けることが大切です。,true
BT273,ビジネス豆知識,法務・コンプライアンス,秘密情報,秘密情報は、相手・場所・方法を意識して扱う必要があります。,true
BT274,ビジネス豆知識,会計・数字,証憑管理,証憑を整理しておくことは、後日の確認と説明のしやすさにつながります。,true
BT275,ビジネス豆知識,顧客・取引,提案の根拠,提案には、効果や根拠を添えると納得感が高まります。,true
BT276,ビジネス豆知識,顧客・取引,ニーズと言葉,顧客が使う言葉を理解すると、伝わる提案に近づきます。,true
BT277,ビジネス豆知識,IT・DX,権限見直し,不要になったシステム権限を見直すことは、情報管理の安全性向上につながります。,true
BT278,ビジネス豆知識,時間管理,優先順位,仕事は重要度と期限の両方で整理すると、優先順位を決めやすくなります。,true
BT279,ビジネス豆知識,文書・メール,数字の根拠,数字を示すときは出所を添えると、説明の信頼性が高まります。,true
BT280,ビジネス豆知識,マネジメント,支援確認,進捗確認では、遅れだけでなく支援が必要かを確認すると、チームの成果につながります。,true
BT281,ビジネス豆知識,個人情報,不要データ,不要になった個人情報は、ルールに沿って削除・廃棄すると、管理リスクを減らせます。,true
BT282,ビジネス豆知識,法務・コンプライアンス,公平な判断,公平な判断は、関係者からの信頼を守る基盤になります。,true
BT283,ビジネス豆知識,営業,顧客理解,営業では、商品説明の前に顧客の課題を理解することが重要です。,true
BT284,ビジネス豆知識,チームワーク,協力,協力しやすい状態を作ることも、成果を出すための大切な仕事です。場面に応じて使い分けることが大切です。,true
BT285,ビジネス豆知識,コミュニケーション,前提共有,話し合いでは前提条件をそろえることで、議論のすれ違いを減らせます。,true
BT286,ビジネス豆知識,IT・DX,データ持ち出し,データを持ち出すときは、必要性と保護方法をセットで考えることが大切です。,true
BT287,ビジネス豆知識,文書・メール,説明資料,説明資料は、結論・理由・根拠の順に整理すると理解されやすくなります。,true
BT288,ビジネス豆知識,思考法,視点変更,視点を変えると、同じ問題でも別の解決策が見つかることがあります。場面に応じて使い分けることが大切です。,true
BT289,ビジネス豆知識,チームワーク,引き継ぎ,引き継ぎでは、作業手順だけでなく判断の背景も残すと役立ちます。,true
BT290,ビジネス豆知識,リスク管理,判断基準,迷ったときの判断基準を事前に決めておくと、対応のばらつきを減らせます。,true
BT291,ビジネス豆知識,リスク管理,緊急連絡,緊急時の連絡先や手順を確認しておくと、初動対応を早められます。,true
BT292,ビジネス豆知識,時間管理,タスク棚卸し,抱えているタスクを見える化すると、抜け漏れに気づきやすくなります。,true
BT293,ビジネス豆知識,法務・コンプライアンス,権限の確認,権限を確認してから進めることは、組織としてのリスク管理につながります。,true
BT294,ビジネス豆知識,営業,顧客対応,顧客対応では、スピードと正確さの両方が信頼につながります。,true
BT295,ビジネス豆知識,業務改善,標準化,よく行う作業は標準化すると、品質のばらつきと属人化を減らせます。,true
BT296,ビジネス豆知識,会計,売上と利益,売上が増えても、費用が増えれば利益が減ることがあります。,true
BT297,ビジネス豆知識,取引先対応,依頼明確化,取引先への依頼は、期限と必要情報を明確にすると、認識違いを防げます。,true
BT298,ビジネス豆知識,マネジメント,変化の伝え方,変化を伝えるときは、背景と目的を説明すると受け入れられやすくなります。,true
BT299,ビジネス豆知識,思考法,逆算思考,ゴールから逆算すると、今やるべきことが見えやすくなります。,true
BT300,ビジネス豆知識,業務・品質,整理3,情報を整理すると、次に取るべき行動が見えやすくなります。日々の業務でも意識したい視点です。,true
BT301,ビジネス豆知識,キャリア・健康,キャリア自律,自分のキャリアを考えることは、日々の学びや挑戦を選ぶ基準になります。,true
BT302,ビジネス豆知識,経営,上場会社,上場会社には、透明性や適時適切な情報管理が強く求められます。,true
BT303,ビジネス豆知識,業務・品質,整理,情報を整理すると、次に取るべき行動が見えやすくなります。場面に応じて使い分けることが大切です。,true
BT304,ビジネス豆知識,取引先対応,公平性,取引先対応では、公平性と透明性を意識することが信頼の土台になります。,true
BT305,ビジネス豆知識,業務・品質,整理,情報を整理すると、次に取るべき行動が見えやすくなります。場面に応じて使い分けることが大切です。,true
BT306,ビジネス豆知識,文書・メール,読み手設計,資料は読み手の知識量に合わせると、伝わりやすさが高まります。,true
BT307,ビジネス豆知識,キャリア・健康,振り返り習慣,定期的な振り返りは、経験を次の行動に変えるために役立ちます。,true
BT308,ビジネス豆知識,時間管理,着手の早さ,早めに着手すると、不明点やリスクを早期に見つけやすくなります。,true
